"Status","Start Time","Stop Time","Duration in ms","Parent Suite","Suite","Sub Suite","Test Class","Test Method","Name","Description"
"passed","Tue Sep 02 23:58:06 UTC 2025","Tue Sep 02 23:58:06 UTC 2025","65","","tests.PlaceholderTest","","tests.PlaceholderTest","should get post comment by id","should get post comment by id()",""
"passed","Tue Sep 02 23:58:06 UTC 2025","Tue Sep 02 23:58:06 UTC 2025","212","","tests.PlaceholderTest","","tests.PlaceholderTest","Should get all posts","Should get all posts()",""
"passed","Tue Sep 02 23:58:06 UTC 2025","Tue Sep 02 23:58:06 UTC 2025","93","","tests.PlaceholderTest","","tests.PlaceholderTest","Should get comment by postId","Should get comment by postId()",""
"passed","Tue Sep 02 23:58:06 UTC 2025","Tue Sep 02 23:58:06 UTC 2025","140","","tests.PlaceholderTest","","tests.PlaceholderTest","Should get posts by id","Should get posts by id()",""
"passed","Tue Sep 02 23:58:02 UTC 2025","Tue Sep 02 23:58:06 UTC 2025","3413","","tests.PlaceholderTest","","tests.PlaceholderTest","Should create post","Should create post()",""
